chunk,page,difficulty,topic,question,option_A,option_B,option_C,option_D,correct_answer
1,0,Easy,Chemical Change,Which of the following is the best indication that a chemical change has occurred?,"A change in state, such as melting.",A change in color or odor.,Dissolving a substance in water.,Crushing a solid into a powder.,B
1,0,Medium,Chemical Reactions,"In a chemical reaction, what is fundamentally altered?",The number of atoms of each element.,The physical state of the reactants.,The arrangement of atoms within molecules.,The total mass of the system.,C
1,0,Hard,Conservation of Mass,"Considering the law of conservation of mass, if a reaction produces a gas that escapes into the atmosphere, how would you accurately determine the mass of the products?",Measure the mass of the remaining solid and liquid products.,Assume the mass of the gas is negligible and only measure the remaining products.,Trap and measure the mass of the gas in addition to the remaining products.,Calculate the theoretical yield of the products based on the initial reactants and subtract any observed mass loss.,C
2,1,Easy,Chemical Reaction Indicators,Which of the following observations most directly suggests that a chemical reaction has occurred?,Decrease in pressure,Change in volume,Change in color,Increase in density,C
2,1,Medium,Chemical Equations,"In a chemical equation, what does the arrow typically indicate?",The need for a catalyst,The direction of the reaction,The equilibrium state,The presence of heat,B
2,1,Hard,Reactants and Products,Which of the following statements accurately describes the relationship between reactants and products in a chemical reaction?,Reactants are formed from products.,Products are transformed into reactants.,"Reactants are the initial substances, while products are the final substances.",Reactants and products always have the same physical state.,C
3,2,Easy,Chemical Equations,Which of the following best describes a chemical equation?,A list of ingredients needed for a reaction.,A visual representation of a chemical reaction using symbols and formulae.,A detailed description of the steps in a chemical reaction.,A scientific hypothesis about a chemical reaction.,B
3,2,Medium,Balancing Equations,"According to the law of conservation of mass, what must be true of a balanced chemical equation?",The total number of molecules on both sides of the equation must be equal.,The physical states of reactants and products must be the same.,The total mass of the reactants must equal the total mass of the products.,The total number of elements on each side of the arrow must be different.,C
3,2,Hard,Stoichiometry,Which of the following is the primary reason for balancing chemical equations?,To ensure the reaction occurs at a reasonable rate.,To satisfy the law of definite proportions.,"To accurately represent the molar ratios of reactants and products, consistent with the law of conservation of mass.",To predict the equilibrium constant for the reaction.,C
4,3,Easy,Chemical Equations,What is the primary goal when balancing a chemical equation?,To change the subscripts of the chemical formulas to equalize atoms.,To adjust the coefficients in front of the chemical formulas to conserve mass.,To remove elements from the equation until it is simplified.,To create new chemical compounds on the product side of the equation.,B
4,3,Medium,Stoichiometry,Why is it incorrect to change the subscripts within a chemical formula when balancing a chemical equation?,It alters the physical state of the substance.,It changes the chemical identity of the substance.,"It only affects the mass of the substance, not the moles.",It is permissible if you maintain the same ratio of elements.,B
4,3,Hard,Balancing Redox Reactions,"In balancing a complex chemical equation, especially a redox reaction, what is often the MOST strategic first step after listing the number of atoms?",Balancing the hydrogen and oxygen atoms first.,Balancing the element that appears in the fewest compounds.,Balancing the element present in the compound with the highest number of atoms.,Balancing the element that is easiest to visualize and count on both sides.,C
5,4,Easy,Chemical Equations,Which of the following represents the general form of a balanced chemical equation?,Reactants → Products,Products → Reactants,Reactants + Energy → Products,Reactants → Products + Energy,A
5,4,Medium,Stoichiometry,Balancing a chemical equation is primarily done to ensure which of the following scientific laws is followed?,Law of Thermodynamics,Law of Conservation of Mass,Law of Definite Proportions,Law of Multiple Proportions,B
5,4,Hard,Chemical Reactions,"In chemical equations, reaction conditions like temperature or catalysts are often indicated in a specific location. Where are these conditions typically written?",Only below the arrow in the equation.,Only above the arrow in the equation.,Both above and/or below the arrow in the equation.,To the right of the products in the equation.,C
6,5,Easy,Chemical Reactions,Which of the following always occurs during a chemical reaction?,Atoms of one element change into another element.,New elements appear from elsewhere.,Existing chemical bonds are broken or new ones are formed.,Atoms disappear from the mixture.,C
6,5,Medium,Balancing Chemical Equations,"In a balanced chemical equation, what principle must be adhered to?",The number of reactants must equal the number of products.,The total charge of the reactants must equal the total charge of the products.,The physical states of all reactants and products must be the same.,The number of atoms of each element must be the same on both sides of the equation.,D
6,5,Hard,Types of Chemical Reactions,"In which type of chemical reaction do two or more reactants combine to form a single product, and can also be exothermic?",Decomposition reaction,Displacement reaction,Combination reaction,Double displacement reaction,C
7,6,Easy,Chemical Reactions,What type of chemical reaction involves two or more reactants combining to form a single product?,Decomposition reaction,Displacement reaction,Combination reaction,Neutralization reaction,C
7,6,Medium,Exothermic Reactions,Which of the following is a characteristic of an exothermic reaction?,Absorption of heat from the surroundings,Decrease in temperature of the system,Release of heat to the surroundings,No change in temperature,C
7,6,Hard,Chemical Equations,"Consider a reaction where a compound reacts with oxygen to produce carbon dioxide, water, and energy. Which of the following reaction types best describes this process?",Endothermic decomposition,Exothermic combination,Endothermic combustion,Exothermic combustion,D
8,7,Easy,Chemical Reactions,What type of chemical reaction involves a single reactant breaking down into multiple products?,Combination Reaction,Displacement Reaction,Decomposition Reaction,Neutralization Reaction,C
8,7,Medium,Thermal Decomposition,Which of the following conditions is most necessary for thermal decomposition to occur?,Presence of a catalyst,Application of heat,Addition of water,High pressure,B
8,7,Hard,Products of Decomposition,"In a decomposition reaction where a metal sulphate is heated, what are the most likely products to be released?",Metal oxide and sulfur dioxide only,"Metal oxide, sulfur dioxide, and sulfur trioxide",Metal sulfide and oxygen,Metal hydroxide and hydrogen sulfide,B
9,8,Easy,Chemical Decomposition,Which of the following is a common characteristic of decomposition reactions?,Formation of complex compounds,Requirement of energy input,Combination of multiple reactants,Release of thermal energy.,B
9,8,Medium,Electrolysis,"In electrolysis, what is the primary function of adding an electrolyte to the water?",To decrease the boiling point of water,To increase the rate of evaporation,To increase the electrical conductivity,To neutralize the pH of the solution,C
9,8,Hard,Redox Reactions,"In the decomposition of silver chloride exposed to sunlight, which substance undergoes reduction?",Silver ions (Ag+),Chloride ions (Cl-),Silver metal (Ag),Chlorine gas (Cl2),A
10,9,Easy,Chemical Reactions,What is a process in which energy is absorbed?,Exothermic reaction,Endothermic reaction,Neutralization reaction,Precipitation reaction,B
10,9,Medium,Decomposition Reactions,Which of the following energy types is most commonly associated with decomposition reactions?,Kinetic,Thermal,Nuclear,Potential,B
10,9,Hard,Displacement Reactions,"In a displacement reaction, what primarily determines whether one element will displace another in a compound?",The molar mass of the elements,The relative reactivity of the elements,The physical state of the elements,The temperature of the reaction,B
11,10,Easy,Types of Chemical Reactions,"In a chemical reaction, if one element is replaced by another in a compound, this is best described as what kind of reaction?",Synthesis Reaction,Decomposition Reaction,Displacement Reaction,Neutralization Reaction,C
11,10,Medium,Reactivity Series,"Based on reactivity, which of the following statements is generally true about metals in displacement reactions?",Less reactive metals can displace more reactive metals.,All metals can displace each other equally.,More reactive metals can displace less reactive metals.,Reactivity has no impact on displacement reactions.,C
11,10,Hard,Precipitation Reactions,Which of the following is the MOST accurate characteristic of a precipitation reaction?,It always involves the formation of gases.,It always involves the formation of an insoluble solid.,It always involves the formation of acids and bases.,It always involves the formation of only soluble products.,B
12,11,Easy,Reaction Types,"A reaction in which ions are exchanged between reactants, leading to the formation of new compounds, is best described as a:",Synthesis reaction,Decomposition reaction,Single displacement reaction,Double displacement reaction,D
12,11,Medium,Oxidation and Reduction,"In a redox reaction, the substance that loses oxygen is said to be:",Oxidized,Reduced,Catalyzed,Neutralized,B
12,11,Hard,Redox Reactions,Which of the following statements accurately describes the simultaneous processes occurring in a redox reaction?,Oxidation and reduction both involve a loss of electrons.,Oxidation involves a loss of electrons while reduction involves a gain of electrons.,Oxidation involves a gain of electrons while reduction involves a loss of electrons.,Oxidation and reduction both involve a gain of electrons.,B
13,12,Easy,Oxidation and Reduction,Which of the following processes involves oxidation?,Gain of electrons,Loss of electrons,Gain of hydrogen,Loss of oxygen,B
13,12,Medium,Corrosion,Which of the following is NOT a typical consequence of corrosion?,Structural weakening of metal objects,Change in the appearance of a metal surface,Increase in the electrical conductivity of the metal,Formation of oxides on the metal surface,C
13,12,Hard,Rancidity,The primary reason for flushing bags of chips with nitrogen gas is to:,Enhance the flavor of the chips,Prevent the chips from being crushed during transport,Prevent oxidation of fats and oils in the chips,Maintain the crispness of the chips by absorbing moisture,C
14,13,Easy,Chemical Equations,Which of the following best describes a balanced chemical equation?,An equation where the number of molecules is the same on both sides.,An equation that only shows the reactants.,An equation where the number of atoms of each element is equal on both sides.,An equation that has an equal number of positive and negative charges on each side.,C
14,13,Medium,Types of Chemical Reactions,A chemical reaction that releases heat into the surroundings is classified as:,Endothermic,Exothermic,Neutralization,Redox,B
14,13,Hard,Oxidation and Reduction,"In a redox reaction, which process describes the loss of electrons by a substance?",Reduction,Oxidation,Neutralization,Hydration,B
15,14,Easy,Chemical Reactions,Which of the following is a chemical reaction?,Melting ice,Dissolving sugar in water,Burning wood,Boiling water,C
15,14,Medium,Balanced Equations,Why is it essential to balance chemical equations?,To ensure the reaction occurs quickly.,To satisfy the Law of Conservation of Mass.,To make the reaction exothermic.,To increase the yield of the products.,B
15,14,Hard,Reaction Types,Which type of chemical reaction involves one element displacing another in a compound?,Synthesis,Decomposition,Neutralization,Single Displacement,D
16,15,Easy,Chemical Reactions,Which of the following is a general characteristic of a chemical reaction?,Change in mass,Formation of new substances,Change in volume,Change in color,B
16,15,Medium,Oxidation and Reduction,"In a redox reaction, what happens to the substance that is reduced?",It gains electrons and its oxidation number increases.,It loses electrons and its oxidation number increases.,It gains electrons and its oxidation number decreases.,It loses electrons and its oxidation number decreases.,C
16,15,Hard,Reaction Types,Which type of chemical reaction involves two compounds exchanging ions or bonds to form two different compounds?,Combination Reaction,Decomposition Reaction,Single Displacement Reaction,Double Displacement Reaction,D
17,2,Easy,Stoichiometry,"In a balanced chemical equation, what must be equal on both sides of the equation?",The total mass of each element,The total number of molecules,The total volume of gases,The total number of different elements,A
17,2,Medium,Chemical Equations,Which of the following indicates that a chemical equation is balanced?,Coefficients are the same on both sides,Subscripts are the same on both sides,The number of each type of atom is the same on both sides,The total charge is equal to zero on both sides,C
17,2,Hard,Conservation of Mass,"If the number of atoms of each element remains constant throughout a chemical reaction, which fundamental principle is being demonstrated?",The law of definite proportions,The law of multiple proportions,The law of conservation of mass,Avogadro's law,C
18,3,Easy,Chemical Equations,What principle is most important when balancing chemical equations?,Maintaining the same total charge on both sides.,Ensuring the states of matter are correctly labeled.,Conserving the number of atoms of each element.,Minimizing the coefficients used in the equation.,C
18,3,Medium,Stoichiometry,"In a balanced chemical equation, the coefficients represent:",The mass of each molecule involved.,The volume of each substance involved.,The mole ratio of reactants and products.,The density of each substance involved.,C
18,3,Hard,Balancing Redox Reactions,"When balancing a redox reaction, which of the following is crucial for determining the correct coefficients?",Ensuring only whole number coefficients are used.,Balancing the charges and the number of atoms.,Minimizing the overall size of the coefficients.,"Balancing the number of oxygen atoms first, then hydrogen.",B
19,4,Easy,Chemical Equations,"In a balanced chemical equation, what must be the same on both sides?",The physical states of all substances,The total number of molecules,The number of atoms of each element,The coefficients of all reactants and products,C
19,4,Medium,Stoichiometry,What information is primarily gained from balancing chemical equations?,The rate of the reaction,The energy released or absorbed,The mole ratios of reactants and products,The reaction mechanism,C
19,4,Hard,Balancing Equations,Which of the following represents the most fundamental reason for ensuring a chemical equation is balanced?,To satisfy the law of definite proportions,To ensure conservation of mass,To facilitate experimental observation of reaction rates,To visualize the reaction pathway more accurately,B
20,5,Easy,Chemical Equations,Which of the following is a necessary component of a balanced chemical equation?,Equal number of atoms of each element on both sides of the equation.,Different states of matter for reactants and products.,More reactants than products.,Presence of a catalyst on the product side.,A
20,5,Medium,Chemical Reactions,"In a chemical reaction, what does the term ""state symbol"" primarily indicate?",The color of the reactants and products.,"The physical state of the substance (solid, liquid, gas, or aqueous).",The temperature at which the reaction occurs.,The concentration of the reactants.,B
20,5,Hard,Balancing Equations,Why is it essential to balance chemical equations according to the law of conservation of mass?,To ensure the reaction proceeds at a desired rate.,"To visually represent the reaction clearly, regardless of atomic conservation.",To demonstrate that matter is neither created nor destroyed in a chemical reaction.,To indicate the energy released or absorbed during the reaction.,C
21,8,Easy,Experimental Setup,Which of the following is MOST crucial for establishing an electrical connection in this setup?,The water level in the mug,The type of mug used,The connection to a battery,The size of the rubber stoppers,C
21,8,Medium,Chemical Reactions,The introduction of dilute sulfuric acid primarily serves to:,Increase the water temperature,Act as a catalyst for the reaction,Change the color of the solution,Decrease the rate of bubble formation,B
21,8,Hard,Stoichiometry and Gas Laws,"Assuming ideal gas behavior, if the experiment is performed under standard temperature and pressure (STP), what additional information would be needed to calculate the moles of gas collected in one of the test tubes?",The concentration of sulfuric acid used,The volume of the test tube,The surface area of the carbon electrodes,The current supplied by the battery,B
22,9,Easy,Chemical Reactions,Which of the following best describes a reaction that releases heat into the surroundings?,Sublimation,Endothermic,Exothermic,Neutralization,C
22,9,Medium,Stoichiometry,"In a chemical reaction, if the ratio of reactants to products is not 1:1, what does this indicate about the reaction?",The reaction is at equilibrium.,The reaction involves gases.,The reaction is irreversible.,Different amounts of each product are formed.,D
22,9,Hard,Chemical Formulas and Nomenclature,What is the chemical formula for a compound comprised of a group 2 element and ammonium chloride?,XCl,XCl₂,X(NH₄)₂,X(NH₄)Cl,B
23,10,Easy,Data Representation,Which of the following is a common way to visually represent data?,Algorithm,Variable,Chart,Function,C
23,10,Medium,Spatial Reasoning,"Considering relative positions, which term best describes the arrangement of objects in a defined area?",Abstraction,Distribution,Iteration,Recursion,B
23,10,Hard,Pattern Recognition,Identifying recurring elements and their relationships within a complex structure primarily relies on which of the following cognitive processes?,Data Encryption,Pattern Recognition,Algorithmic Decomposition,Heuristic Evaluation,B
24,12,Easy,Chemical Reactions,Which of the following is a characteristic sign that a chemical reaction has taken place?,Change in physical state,Change in volume,Change in mass,Change in temperature,A
24,12,Medium,Displacement Reactions,"In a single displacement reaction, what determines whether one element will displace another from a compound?",The temperature of the solution.,The concentration of the compound.,The relative reactivity of the elements.,The physical state of the elements.,C
24,12,Hard,Redox Reactions,Which of the following statements accurately describes oxidation in a chemical reaction?,"Loss of electrons, resulting in a decrease in oxidation number.","Gain of electrons, resulting in an increase in oxidation number.","Loss of electrons, resulting in an increase in oxidation number.","Gain of electrons, resulting in a decrease in oxidation number.",C
